author,date,description,tags,title
Alejandro Saucedo,July 2019,"This talk will provide an overview of the key challenges and trends in the productization of machine learning systems, including concepts such as reproducibility, explainability and orchestration. The talk will also provide a high level overview of several key open source tools and frameworks available to tackle these issues, which have been identifyed putting together the Awesome Machine Learning Operations list (https://github.com/EthicalML/awesome-machine-learning-operations). ","Architecture,Data,Data Science,Deep Learning,Machine-Learning",The state of Machine Learning Operations in 2019
Pablo Salgado,July 2019,# Why,"Abstractions,CPython,Performance,python",The soul of the beast
Dougal Matthews,July 2019,"Software infrastructure is changing. Microservices, Containers, Continuous Integration, Serverless and many other ideas are growing in popularity. This added complexity comes with benefits but it is harder to answer simple questions about system behaviour. Do you know what is happening in your production app?","Deployment/Continuous Integration and Delivery,Distributed Systems,Docker,Microservices",The Secret Life of Software
Sebastian Roll,July 2019,"Customer lock-in. Dubious “Land and Expand” strategies. We have all heard about outsourced software projects that run far past schedule and obliterates the budget, yet somehow fail to meet even basic requirements. ","Business,Clients,Ethics,Management,freelancing",The Dangers of Outsourcing Software Development
Stephan Jaensch,July 2019,"A main advantage of microservices is improved developer velocity. One roadblock to achieving it is giving developers the confidence that their changes are correct and safe, which is a challenging problem in such a distributed architecture. Typical approaches involve relying on automated end-to-end testing, which is costly to set up, develop tests for and run.","Distributed Systems,Microservices,Testing,python",Testing Microservices: fast and with confidence
Anastasiia Tymoshchuk,July 2019,"Nowadays everyone wants to bring Agile Best Practices into all the teams, but it's a hard task to implement it and adapt based on different teams. Setting up all necessary Agile meetings and using buzz words is not enough for the team to be happy and successful while working in Agile environment.,Inspired by the ""Divine Comedy"" by Dante Alighieri, I decided to create a short guide into Agile best practices. It will guide through Failures, Challenges to the Success in building a happy dream team!,This talk is divided into three parts:,1. Failures in setting up Agile processes for a team.,2. Challenges on the way to happy and successful team.,3. Successful examples how to have happy and productive Agile team and constantly deliver a great product.","Agile,Development,General,The Answer to Life the Universe and Everything Else",The Agile comedy: from hell to paradise
Michele De Simoni,July 2019,"The talk will showcase the main features of this new TF version that should appease the needs of the Researcher and Practitioner alike. A focus will be put on:,- Keras as the new standard API,- Eager Mode & Graph ,- Production Pipeline,- Extended Ecosystem","APIs,Beginners,Data Science,Deep Learning,Machine-Learning",TensorFlow 2.0: TensorFlow Strikes Back
Chiin-Rui Tan,July 2019,What is OSINT? And who cares?     ,"Algorithms,Data,Machine-Learning,Open-Source,Web Crawling",Tech-Powered OSINT: hunting for intelligence in open sources with Python
Lilian Nandi anonymous,July 2019,"Our generation of young people in school (aged 5-18) have noticed the connection between Computer pRogramming, Technology & Success and Billionaires.On mass they are clamoring to master the skill of Computer pRogramming. We describe a successful working model for the teaching of Computer pRogamming.","All Other Programming Languages,Education,Programming,Python 3,Teaching",Teaching Programming to the Next Generation
Shailen Sobhee,July 2019,"In this talk, you will learn various optimization techniques to improve the runtime performance of your deep learning algorithms on Intel architecture. The presentation will cover how to accelerate the training of your deep neural networks with Tensorflow thanks to the highly optimized Intel® Math Kernel Library (Intel® MKL) and how we boost inferencing with Intel® nGraph and with the Intel® Distribution of OpenVINO™.","Data Science,Deep Learning,Open-Source",Supercharge your Deep Learning algorithms with optimized software
Mai Giménez,July 2019,"Tensorflow is one of the most powerful machine learning libraries. ,However, one could argue that it is as well one of the most convoluted libraries to utilise. Or it used to be. ,Tensorflow has been updating its API, simplifying the pipeline while keeping it flexible. You could either predict your class label using a pre-trained canned estimator or doing some fancy operations with the inner tensors of your neural network. It's a choose your own adventure game. ,But it's challenging to make sense of all the new changes. Fear not. Here, we learned what changes we should adopt. ","Best Practice,Data Science,Deep Learning,Machine-Learning,Scientific Libraries (Numpy/Pandas/SciKit/...)",Tensorflow Estimators
Bernat Gabor,July 2019,"Python is easy to learn and use programming language; however, managing dependencies and package versions for it are nowhere as pleasant. One of the basic building block created to help with this is virtual environments. Join me in understanding how virtual environments work from within (by one of the project maintainers); also, to find out if the good old virtualenv project has any place left, now that Python 3.4+ contains venv.",Virtual Env,status quo of virtual environments
Alisa Dammer,July 2019,"Both Python and Rust are getting more and more popularity. Although it is unfair to compare them directly, this talk aims to provide a clear comparison with a pre-defined criteria applied to a specific use-case. ,Writing a simulation engine is very similar to writing a game engine and requires certain features from a language or framework.,Possible comparison criteria: ,1. Performance,2. Simplicity,3. Amount of code necessary for a MVP,4. Utilities: docs, tests, profile,5. Compatibility","Code Analysis,Development,Rust,python",Python vs Rust for Simulation
Vita Smid,July 2019,"The Python community has been warming up to static typing for a few years now. You may have seen talks that did a great job of introducing the basic concepts, mypy, and high-level strategies to cover existing code bases.","Static Analysis,Type-Hinting",Static typing: beyond the basics of def foo(x: int) -> str:
Radoslav Georgiev,July 2019,Software development is a team game.,"Abstractions,Best Practice,Communication,Django Projects,Management",Software patterns for productive teams
Clinton Roy,July 2019,"A synchrotron is a large research facility that has a large software stack to keep things running, fortunately a large chunk of the stack is Open Source and fair chunk of it is Python to boot. By the end of the talk attendees will understand the scale of the infrastructure (both physical and software) that is required, and have an idea of what sort of problems a synchrotron could help them solve.","ASYNC / Concurreny,Architecture,Big Data,Engineering,Hardware/IoT",Running a Synchrotron on Open Source Python
Samuel Colvin,July 2019,I'm going to talk about the 4 main levels of parallelism in modern Computing:,"ASYNC / Concurreny,Messaging and Job Queues (RabbitMQ/Redis/...),Multi-Processing,Multi-Threading,python",Python's Parallel Programming Possibilities - 4 levels of concurrency
Alessandro Molina,July 2019,"The Python Standard Library is a very rich toolset, which is the reason why Python is stated to come with ""batteries included"". In such an amount of features and tools it's easy to get lost and miss some of the less unknown modules or gems hidden within the whole load of functions and classes.","CPython,Debugging,Development,General,python","Python Standard Library, The Hidden Gems"
Thomas Kluiters,July 2019,"Executing machine learning models in a production environment can be tricky, especially at a major bank where compliance and risk are carefully taken into account. In this talk I explain how, we, at ING (a large bank operating on global scale), execute our Python models in a production environment by building minimal Docker images for python versions.","Data Science,Docker,Machine-Learning,Operations,Security",Securely executing Python machine learning models with distroless images at ING
"Stanislav Geidl,Tin Marković",July 2019,"[Replacement talk],This talk was a replacement for Stanislav Geidl's talk: From legacy code to modern code","Architecture,Clean Code,Development,Python 3,legacy-code",Refactoring in Python
Matthieu Amiguet,July 2019,"At Les Chemins de Traverse we explore ways of ""augmenting"" acoustical musical instruments with new sonic possibilities offered by computers. For doing so, we need ultra-low latency real-time audio processing programs. Pretty much the typical situation where python should *not* be used, right? Wrong. As it happens, that's exactly what we've been doing for the past few years.","Augmented Reality,DIY,Linux,The Answer to Life the Universe and Everything Else,Use Case",Python for realtime audio processing in a live music context
Paul Everitt,July 2019,"“Come for the language, stay for the community.” The Python community started in 1994 at a NIST workshop in Maryland. What was the world of Python like in its first years? Did we have any clue whatsoever? A joke-focused tour of early Python, heavy on question-and-answer.",Community,Python 1994
Marc-Andre Lemburg,July 2019,"Python has become the defacto standard tool for many people to write tools, command scripts, smaller applications and even large applications.","CPython,Development,Linux,Tooling,Use Case",PyRun - Shipping the Python 3.7 runtime in just 4.8MB
Philipp Thomann,July 2019,"Are you bored by 3D-plots that only give you a simple rotatable 2d-projection? plotVR is an open source package that provides a simple way for data scientists to plot data, pick up a phone, get a real 3d impression - either by VR or by AR - and use the computer's keyboard to walk through the scatter plot:","3D,Augmented Reality,Data Science,Open-Source,Visualization",PlotVR - walk through your data
Mark Smith,July 2019,"Always wanted to publish a package on PyPI, but didn't know where to start? This talk is for you! Starting with nothing, we'll build a package and publish it on PyPI using current best practices.","Best Practice,Packaging,Python 3",Publish a (Perfect) Python Package on PyPI
Reuven Lerner,July 2019,"Decorators are one of Python's most powerful features. But even if you understand what they do, it's not always obvious what you can do with them. Sure, from a practical perspective, they let you remove repeated code from your callables. And semantically, they let you think at a higher level of abstraction, applying the same treatment to functions and classes.","Compiler and Interpreters,Data Structures,Programming,Python Skills,Python general",Practical decorators
Juan Santos,July 2019,"Reading standards documents can be a dull task. But like in other fields, standards in Python play a big part. Python Enhancement Proposals (PEPs) are defined, improved, and eventually implemented by the community. They apply to mostly anything related to Python, from the more abstract and general to the more concrete and specific. Paying attention to them, and knowing which ones to read beforehand is a vital task that should take place prior to writing the first lines of code in a project.","Clean Code,Python Skills,Python general",PEP yourself: 10 PEPs you should pay attention to
Pierre Glaser,July 2019,"Parallel computing in Python: Current state and recent advances,---------------------------------------------------------------","Distributed Systems,Multi-Processing,Multi-Threading,Performance,Scientific Libraries (Numpy/Pandas/SciKit/...)",Parallel computing in Python: Current state and recent advances
Teresa Ingram,July 2019,"""Although people of all genders can experience violence and abuse online, the abuse experienced by women is often sexist or misogynistic in nature, and online threats of violence against women are often sexualized and include specific references to women’s bodies. "" - Amnesty International. This abuse pushes women offline, affecting their social well-being, representation and economic potential. ","Communication,Data Science,Open-Source,TDD,Web",Opt Out of Online Sexism – Open Source Activism
Ronan Lamy,July 2019,"PyPy is a fast and compliant implementation of Python. In other words, it's an interpreter for the Python language that can act as a full replacement for the reference interpreter, CPython. It's optimised to enable efficient just-in-time (JIT) compilation of Python code to machine code, and has releases matching versions 2.7, and 3.6. It now also supports the main pillars of the scientific ecosystem (numpy, Cython, scipy, pandas, ...) thanks to its emulation layer for the C API of CPython.","Compiler and Interpreters,PyPy",Opening PyPy's magic black box
Dmitry Figol,July 2019,"Do you deploy Python applications in Docker? Then this session is for you! ,We will start by reviewing a simple Dockerfile to package a Python application and move to more complex examples which speed up the build process and reduce the size of the resulting Docker image for both development and production builds.","Deployment/Continuous Integration and Delivery,Docker",Optimizing Docker builds for Python applications
Hubert Bryłkowski,July 2019,"Getting started with a natural language processing and neural networks is easier nowadays thanks to the numerous talks and tutorials. The goal is to dive deeper for those who already know the basics, or want to expand their knowledge in a machine learning field. ,The talk will start with the common use cases that can be generalized to the specific problems in a NLP world. Then I will present an overview of possible features that we can use as input to our network, and show that even simple feature engineering can change our results.,Furthermore, I will compare different network architectures - starting with the fully connected networks, through convolution neural networks to recursive neural networks. I will not only considering the good parts, but also - what is usually overlooked - pitfalls of every solution. ,All of these  will be done considering number of parameters, which transfers into training and prediction costs and time. I will also share a number of “tricks” that enables getting the best results even out of the simple architectures, as these are usually the fastest and quite often hard to beat, at the same time being the easiest to interpret.","Data Science,Deep Learning,Machine-Learning,Natural Language Processing",Natural language processing with neural networks.
Lennart Regebro,July 2019,"Next year Python 2 is no longer maintained. But you have a monster code base with clever tricks and libraries that don't support Python 2, and your data may be stored in a format that is hard to move Python 3. And that's the easy bit.","Deployment/Continuous Integration and Delivery,Management,Python 3,Testing",Moving big projects to Python 3
Jovan Veljanoski,July 2019,"Working with datasets comprising millions or billions of samples is an increasingly common task, one that is typically tackled with distributed computing. Nodes in high-performance computing clusters have enough RAM to run intensive and well-tested data analysis workflows. More often than not, however, this is preceded by the scientific process of cleaning, filtering, grouping, and other transformations of the data, through continuous visualizations and correlation analysis. In today’s work environments, many data scientists prefer to do this on their laptops or workstations, as to more effectively use their time and not to rely on spotty internet connection to access their remote data and computation resources. Modern laptops have sufficiently fast I/O SSD storage, but upgrading RAM is expensive or impossible.","Algorithms,Big Data,Data Science,Machine-Learning,python",Modern Data Science with Vaex: A new approach to DataFrames and pipelines
Peter Bittner,July 2019,"Deployment automation, cloud platforms, containerization, short iterations to develop and release software—we’ve progressed a lot. And finally it’s official: Kubernetes and OpenShift are the established platforms to help us do scaling and zero downtime deployments with just a few hundred lines of YAML. It’s a great time.","Agile,Best Practice,Clean Code,Deployment/Continuous Integration and Delivery",Modern Continuous Delivery for Python Developers
Hynek Schlawack,July 2019,"PyPI is a gold mine of great packages but those packages have to be written first. More often than not, projects that millions of people depend on are written and maintained by only one person. If you’re unlucky, that person is you!","Best Practice,Open-Source",Maintaining a Python Project When It’s Not Your Job
Gael Varoquaux,July 2019,"According to industry surveys [1], the number one hassle of data scientists is cleaning the data to analyze it. Textbook statistical modeling is sufficient for noisy signals, but errors of a discrete nature break standard tools of machine learning. I will discuss how to easily run machine learning on data tables with two common dirty-data problems: missing values and non-normalized entries. On both problems, I will show how to run standard machine-learning tools such as scikit-learn in the presence of such errors. The talk will be didactic and will discuss simple software solutions. It will build on the latest improvements to scikit-learn for missing values and the DirtyCat package [2] for non normalized entries. I will also summarize theoretical analyses in recent machine learning publications. ","Big Data,Data,Data Science,Machine-Learning,Scientific Libraries (Numpy/Pandas/SciKit/...)",Machine learning on non curated data
Miguel Grinberg,July 2019,"In this talk I'm going to live code a web application that is built exclusively on top of WebSocket, without using HTTP at all!","ASYNC / Concurreny,Web Protocols,Web Servers and MicroFWs (Flask/Tornado/Nginx/...)","Look Ma, No HTTP!"
Christoph Heer,July 2019,"Python's Global Interpreter Lock is a friend and rival at the same time. We, as developers, can focus on the design and implementation of applications without the hassle of memory management. On the other side, we complain about the GIL as the limiting factor of performance sensitive applications. Therefore, it is common to refactor parts of systems when the system doesn't perform or scale enough anymore. The refactoring often includes the switch of the used concurrency paradigms like replacing multithreading with multiprocessing or asyncio. Another option is moving logic of CPU-bound workload into C extensions or a full rewrite in a ""GIL-free"" language. But how do you know that the GIL is the actual performance bottleneck?","ASYNC / Concurreny,Multi-Threading,Performance,Scaling,Tooling","Is it me, or the GIL?"
Joe Drumgoole,July 2019,"This talk will give anyone who has a basic knowledge of Python insight into how,easy it is to build database applications using the PyMongo Python library for MongoDB. There will be live coding!",python,Introduction to Python and MongoDB
Christian Heimes,July 2019,"Python has built-in tracing and profiling facilities in form of callback hooks in the sys module. The settrace and setprofile callbacks have several drawbacks. They slow down the Python interpreter considerable and only allow tracing of Python code. Modern OS and CPUs come with a variety of APIs for efficient and low-level tracing down to system calls, Kernel space code, and hardware events. Some tools even create code that runs in Kernel space.","CPython,DevOps general,Performance",Introduction to low-level profiling and tracing
Ivana Kellyerova,July 2019,"It's often said that Python comes with batteries included, meaning that the standard library can do basically anything except for maybe conjure bacon for you (though I heard that's coming in 3.8). I don't think we fully appreciate the sheer vastness of it, though, so I went through it module by module looking for hidden gems (sorry, eggs). This is a by no means exhaustive compilation of the useful, the underrated, and the funny.","CPython,Python general,The Answer to Life the Universe and Everything Else",import bacon 🥓
Emmanuelle Gouillart,July 2019,"Images are an ubiquitous form of data in various fields of science and,industry. Images often need to be transformed and processed, for example for helping medical diagnosis by extracting regions of interest or measures, or for building training sets for machine learning. ","Computer Vision,Data Science,Image Processing,JavaScript Web Frameworks (AngularJS/ReactJS/...),Scientific Libraries (Numpy/Pandas/SciKit/...)",Image processing with scikit-image and Dash
Alexys Jacob,July 2019,"In this talk I would like to share the workflow and tools we use to build, deploy and operate GraphQL APIs on our on-premise Kubernetes cluster.","APIs,Best Practice,Case Study,Docker,Infrastructure",How we run GraphQL APIs in production on our Kubernetes cluster
Antonio Cuni,July 2019,"Real-world JIT compilers like PyPy and Numba are complex and advanced. However, the basic ideas behind JIT compilers are easy to understand, as this talk aim to show.","Compiler and Interpreters,Development,TDD",How to write a JIT compiler in 30 minutes
Rogier van der Geer,July 2019,"Neural networks are everywhere nowadays. But while it seems everyone is using them, training your first neural network can be quite a hurdle to overcome.","Deep Learning,Fun and Humor,Image Processing,Machine-Learning,Scientific Libraries (Numpy/Pandas/SciKit/...)",How to train an image classifier using PyTorch
Wojciech Rząsa,July 2019,"HTTP or asynchronous communication in microservices? This question is frequently repeated and discussed. Obviously, HTTP-based communication is easier for developers and architects. Even if your developers have no prior experience with microservices, they will probably understand how to implement an HTTP service well. While asynchronous communication has a lot of advantages that allow to design and implement really robust microservices system, they also bring new challenges not so obvious for people who didn’t have a chance to work with such an environment before.","ASYNC / Concurreny,Communication,Distributed Systems",From HTTP to Kafka-based microservices
Leonardo Rochael Almeida,July 2019,"Object Relational Mappers (ORMs) are awesome enhancers of developer productivity. The freedom of having the library write that SQL and give you back a useful, rich model instance (or a bunch of them) instead of just a tuple or a list of records is simply amazing.","Debugging,Performance,SQL Alchemy,python","From days to minutes, from minutes to milliseconds with SQLAlchemy"
Dimiter Naydenov,July 2019,"Portable Document Format (PDF) is commonly used to produce, publish, exchange, and,archive business and academic documents alike. Often in such PDFs there are tables,with data that you want to extract and process in some automated fashion. Unlike HTML,or other formats, PDF has no concept of tables as rows and columns with related data.","Computer Vision,Image Processing,Natural Language Processing,Scientific Libraries (Numpy/Pandas/SciKit/...),Web Servers and MicroFWs (Flask/Tornado/Nginx/...)",Extracting Tabular Data from PDFs with Camelot and Excalibur
Alexander CS Hendorf,July 2019,"Artificial intelligence promises great value. The technology is mostly understood only by few, yet still unexplainable even for experts.,In this talk I'll present how to narrow the hype down to real value explainable to everyone in your organisation - without the math.","Analytics,Business,Deep Learning,Management",Explaining AI to Managers 👨‍💼🤖👩‍💼
Mario Corchero,July 2019,"Did you know there are multiple ways to raise and capture exceptions? Have you ever wondered if you should raise a built-in exception or create your own hierarchy? Did you ever find it hard to understand what an exception meant?,This talk will go through the decisions needed to raise and capture exceptions when creating a library. We will look at how to translate and handle errors, create your own exceptions, and make exceptions clear and easy to troubleshoot, while also understanding how they actually work, common pitfalls.","Best Practice,Development,General,Python 3,Python Skills",Exceptional Exceptions
"Mikhail Bushkov,Max Vogler",July 2019,GRR Rapid Response (https://github.com/google/grr) is an incident response framework focused on remote live forensics.,"Databases,Deployment/Continuous Integration and Delivery,Development,Open-Source,Security","Evolving a helper script into a 180,000-lines-of-Python-code project"
Trapsilo Bumi,July 2019,Angklung is a traditional musical instrument from Indonesia. This instrument has a lot of variety in how it is performed; a common format is the orchestral format in which 15-30 players gather to form a team. Playing Angklung in this way is fun but also presents some challenges that are hard to solve manually.,"Algorithms,Analytics,Beginners,Case Study,Use Case",Enhancing Angklung Music Rehearsals with Python
