author,date,description,tags,title
James Saryerwinnie,July 2019,"You've been given a task.  You need to download some files from a server to your local machine.   The files are fairly small, and you can list and access these files from the remote server through a REST API.  You'd like to download them as fast as possible.  The catch?  There's a billion of them.  Yes, one billion files.","ASYNC / Concurreny,Case Study,Multi-Processing,Multi-Threading,Performance",Downloading a Billion Files in Python
Tiago Montes,July 2019,"In this talk I reframe a computer programming workshop for kids I delivered earlier this year, exploring and sharing my experience throughout that journey, from preparation to delivery, by recreating a simple yet engaging enough game.","Best Practice,Education,Learning,Life,Python Skills",Don't do this at work
Jan Wagner,July 2019,My talk aims to introduce and have a closer look on the Docker SDK for Python. ,"Deployment/Continuous Integration and Delivery,DevOps general,Docker,Testing,Virtualization",Docker meets Python - A look on the Docker SDK for Python
Cheuk Ho,July 2019,"The diversity statement quoted as follows: “The Python Software Foundation and the global Python community welcome and encourage participation by everyone. Our community is based on mutual respect, tolerance, and encouragement, and we are working to help each other live up to these principles. We want our community to be more diverse: whoever you are, and whatever your background, we welcome you.”","Community,Conferences and Meet-Ups,Data Science,Static Analysis",Do we have a diversity problem in Python community?
Grzegorz Kocjan,July 2019,"What you do when you start a new project? Usually, we begin with database design, then we prepare a migration system, user registration, and all different stuff that distracts us from doing what is most important - business logic. With the clean architecture, we can learn how to start a project in another way and this will be one of two main topics of my talk. The second one will be about new features in Python. You probably heard about typings, mypy, and dataclasses, but I will show you how they can be used in real life project that can be developed over many years in production lifecycle. There will be no ""hello world"" app, no copy & paste of documentation, only practical knowledge learned through many years of practice.","APIs,Abstractions,Architecture,Best Practice,Clean Code",Don't start with a database
Peter Entschev,July 2019,"The search for faster computing remains of great importance to the software community. Relatively inexpensive modern hardware, such as GPUs, allows users to run highly parallel code on thousands, or even millions of cores on distributed systems.","Big Data,Data Science,Distributed Systems,GPU,Scientific Libraries (Numpy/Pandas/SciKit/...)","Distributed Multi-GPU Computing with Dask, CuPy and RAPIDS"
Paolo Galeone,July 2019,"AutoGraph is one of the most exciting new features of Tensorflow 2.0: it allows transforming a subset of Python syntax into its portable, high-performance and language agnostic graph representation bridging the gap between Tensorflow 1.x and the 2.0 release based on eager execution.","Data-Structures,Machine-Learning,New Features,Software Design",Dissecting tf.function to discover AutoGraph strengths and subtleties
Jeff Hollan,July 2019,"Bringing your Python scripts or apps and running them in the cloud is easier than ever with serverless computing. In this talk, we’ll show how you can use Azure Functions to easily deploy and scale your Python workloads without having to manage any servers or pay for unused compute resources. We’ll also show how deep integration with Visual Studio Code offers a great local development experience with full support for debugging and testing your app, and allows you to seamlessly deploy your serverless code to the cloud.","APIs,Development,Microservices,Scaling,Tooling",Deploy Python to the cloud faster with Azure Serverless
Holger Krekel,July 2019,"Delta Chat, a new approach to decentralized messaging, uses Python in several ways. Delta Chat is a Whatsapp/Telegram-style messenger app  which uses the existing e-mail server network instead of central servers. There is no address book upload, and no necessity to tie accounts to mobile numbers. We'll live-demo how ""Chat over E-mail"" works, with random audience members, in real-time. ","Development,Python general,Rust,Sensors,System Administration","Delta Chat, CFFI, pytest and all the Rust"
Brad Miro,July 2019,"Learn about the updates being made to TensorFlow in its 2.0 version. We’ll give an overview of what’s available in the new version as well as do a deep dive into an example using its central high-level API, Keras. You’ll walk away with a better understanding of how you can get started building machine learning models in Python with TensorFlow 2.0 as well as the other exciting available features!","Data Science,Deep Learning,Machine-Learning,Scientific Libraries (Numpy/Pandas/SciKit/...)",Deep Learning with TensorFlow 2.0
Dom Weldon,July 2019,"Your data science or machine learning project probably won't just produce a written report. Instead, projects are increasingly expected to produce interactive tools to allow end-users to explore data and results with rich, interactive visualizations. Inevitably, this will be done in a web browser, meaning you'll need to add a quantitatively trained web developer to your team, or have your data scientists spend time learning HTML, Javascript and CSS. Dash, a project by the team that makes Plotly, solves some of these problems by allowing data scientists to build rich and interactive websites in pure python, with minimal knowledge of HTML and absolutely no Javascript. ","Data Science,JavaScript,Visualization,Web,Web Servers and MicroFWs (Flask/Tornado/Nginx/...)",Dash: Interactive Data Visualization Web Apps with no Javascript
Peter Sperl,July 2019,"Two years ago, we began migrating from a proprietary service framework to a WSGI-compliant one. We chose uWSGI as our host because of its performance and feature set. But, while powerful, uWSGI's defaults are driven by backward compatibility and are not ideal for new deployments. Powerful features can be overlooked due to the sheer magnitude of its feature set and spotty documentation. As we've scaled up the number of services hosted by uWSGI over the last year, we've had to tweak our standard configuration.","Best Practice,Distributed Systems,Microservices,Web Servers and MicroFWs (Flask/Tornado/Nginx/...),failures/mistakes",Configuring uWSGI for Production: The defaults are all wrong
Łukasz Kąkol,July 2019,"Code review is not just boring duty. It's mutual responsibility for the software we're releasing. It's one of the most critical aspects of code quality, and therefore it's the first step of quality assurance. This is also the key to easier programming and better maintainability. Clean code is much easier to debug, and it's much harder to introduce a bug in such code.,When you think about code review, you probably think about verifying and examining the code. Reviewing the expert's code may look like a waste of time because he knows what he's doing. Reviewing the code by a beginner may look like a waste of time because he's not able to find as many defects as an experienced developer. Code review is a code quality tool in the first place, but it's also much beyond that. You can teach or help someone, learn from somebody and much more both from the position of reviewer and reviewee.,There is much more about the real power of code review which I want to share with you.,This talk is also about how to do it the right way and how to not do it based on lessons learned and my experience within the diverse teams of people with a variety of knowledge and experience. I was reviewing the code but, on the other hand, I was also being reviewed. I'd like to pass my observations to people who are reviewing the code both in commercial and open source projects for a while. This talk is also for those who want to start to review the code, but they do not know how to do it.","Best Practice,Clean Code,Code Analysis,Development,Programming",Code review for Beginners and Experts: Tips & Tricks
Radosław Ganczarek,July 2019,"Four years ago I talked about code quality during EuroPython in Bilbao. A lot of things changed from that time. Firstly, most tools I presented were still developed and gained new features, but also new ones appeared I wanted to discuss with you. Secondly, Python changed, Python 3 has type hints on board and there is a new tool dedicated to checking the types. Thirdly - I changed. I'm more distanced form my zealous approach from four years ago. I got real and reasonable. That's why I wanted to talk about code quality tools in Python again.,I'll talk about all the software that can make code review a bit simpler by pointing out possible errors, duplicates or unused code. I'll talk again about formatters and how can they be used in modern-time projects. And I'll talk about hobgoblins, if you know what I mean :)","Best Practice,Code Analysis,Python 3,Tooling,Type-Hinting",Code quality in Python
Nemanja Milosevic,July 2019,"Convolutional neural networks have been used for some time now for classification of images, among other things. Recently, some new research leads us to believe that neural network can be ""tricked"" into wrongly classifying images by adding noise or other artifacts to them. If we want to use Deep Convolutional models in critical scenarios (i.e. self driving cars) we have to be certain that these models that we are using will be certain and robust.","Data,Data Science,Deep Learning,Generative Adversarial Networks,Machine-Learning",Classification Based on Missing Features in Deep Convolutional Neural Networks
Florian Wahl,July 2019,"In this session, we will report about a forklift hailing application we built using MicroPython and the ESP32-based prototyping hardware M5Stack. ,In a production facility, machine operators can hail a forklift using an ESP32 device running MicroPython. The device sends a request to a forklift dispatcher software, written in Python. The request is queued and subsequently, the next available forklift is notified and sent to the machine. Each forklift is also fitted with an ESP32 device. In this project, the prototyping hardware M5Stack was used. It features an ESP32 micro controller with Bluetooth, WIFI, GPIO, three buttons, and a display.","Cross-Platform-Development,DIY,Hardware/IoT,Internet of Things (IoT),MicroPython",Building Industry 4.0 logistics applications with MicroPython and ESP32 MCUs
Paul Hughes,July 2019,This is a case study that documents how a small data science team in a big bank took on the challenge to transform a fragmented sales process into a data-driven one using Python and machine learning. ,"Business Cases,Data Science,Machine-Learning,Scientific Libraries (Numpy/Pandas/SciKit/...),Windows",Building Data-Driven Client Relationship Management in Banking with Python
Nar Kumar Chhantyal,July 2019,"This talk will focus on how one can build complex data pipelines in Python. I will introduce Luigi and show how it solves problems while running multiple chain of batch jobs like dependency resolution, workflow management, visualisation, failure handling etc.","Architecture,Big Data,Data,Distributed Systems,Scaling",Building Data Workflows with Luigi and Kubernetes
Katherine Kampf,July 2019,"Ever wondered what breed that dog or cat is? Let’s build a pet detector service to recognize them in pictures! In this talk, we will walk through the training, optimizing, and deploying of a deep learning model using Azure Notebooks. We will use transfer learning to retrain a MobileNet model using TensorFlow to recognize dog and cat breeds using the Oxford IIIT Pet Dataset. Next, we’ll optimize the model and tune our hyperparameters to improve the model accuracy. Finally, we will deploy the model as a web service in. Come to learn how you can quickly create accurate image recognition models with a few simple techniques!","Data,Data Science,Deep Learning,Jupyter,Machine-Learning",Building a Powerful Pet Detector in Notebooks
Mustafa Anil Tuncel,July 2019,"Reproducibility of research is a common issue in science, especially in computationally expensive research fields e.g. cancer research.,A comprehensive picture of the genomic aberrations that occur during tumour progression and the resulting intra-tumour heterogeneity, is essential for personalised and precise cancer therapies. With the change in the tumour environment under treatment, heterogeneity allows the tumour additional ways to evolve resistance, such that intra-tumour genomic diversity is a cause of relapse and treatment failure.  Earlier bulk sequencing technologies were incapable of determining the diversity in the tumour.  ,Single-cell DNA sequencing - a recent sequencing technology - offers resolution down to the level of individual cells and is playing an increasingly important role in this field. ,We present a reproducible and scalable Python data analysis pipeline that employs a statistical model and an MCMC algorithm to infer the evolutionary history of copy number alterations of a tumour from single cells. The pipeline is built using Python, Conda environment management system and the Snakemake workflow management system. The pipeline starts from the raw sequencing files and a settings file for parameter configurations. After running the data analysis, pipeline produces report and figures to inform the treatment decision of the cancer patient.","Algorithms,Analytics,C-Languages,Command-Line,Data Science",Bioinformatics pipeline for revealing tumour heterogeneity
Andrei Neagu,July 2019,"Have you ever found yourself in a situation where you:,- had to use WbSockets?,- had to to create a separate project and had the issue of interfacing both?,- had to handle disconnections?,- had to handle reconnections?,- had to handle all the above and scale WebSockets?","Mobile,System Architecture,Web,Web Protocols,Web Servers and MicroFWs (Flask/Tornado/Nginx/...)","Better WebSockets - Server-Sent Events, a carefree alternative"
Paul Ganssle,July 2019,"When your Python needs to be fast, one powerful tool is the ability to write compiled extension modules. Normally this is done using the C API, but that requires managing reference counts and memory allocation and is nearly impossible to do *correctly* for non-trivial programs. In this talk, we'll look at how you can write extension modules in Rust - a memory-safe systems programming language that is increasingly popular as a replacement for C and C++, and the [most loved language in the Stack Overflow developer survey 4 years running](https://insights.stackoverflow.com/survey/2019#technology-_-most-loved-dreaded-and-wanted-languages).","All Other Programming Languages,C-Languages,Rust",Build your Python Extensions with Rust!
Franziska Oschmann,July 2019,"Within the last 20 years machine learning (ML) experienced a boost in its impact on our daily lives. With the help of supervised and unsupervised methods tasks like computer vision, recognition of speech or text have been revolutionized. Due to this high impact of ML ongoing research focuses on the constant improvement of these methods. ,However, ML is not exclusively the subject of research, but can also be used as a tool for the investigation of research questions. For example, ML is used to uncover hidden patterns in experimental data not detectable with neither the human eye nor standard statistical methods or to train machines so that they can take over repetitive tasks like object recognition. The increasing usage of ML in research is also due to Python libraries such as keras or scikit-learn. These libraries have simplified the handling of ML methods and thus paved the way for the application of these methods in many different research fields.,This talk is intended to present examples for current applications of ML in research. These use cases deal with the automatic recognition of single neurons throughout a stack of histological images or the prediction of human arm movements based on EEG signals. Based on these use cases an overview of Python-based techniques for data preparation and data analysis applying different techniques ranging from standard ML methods to state-of-the-art implementations of deep neural networks will be given.","Case Study,Data Science,Deep Learning,Machine-Learning",Boosting research with machine learning.
Michal Wysokinski,July 2019,"My team has been running AsyncIO in production for over 2 years now and the only thing I can say about my experience with it is: ""Oh boy, what a rollercoaster of feelings"". I've experienced laughs and tears, sweat and blood but also sang songs of glory. AsyncIO is currently the biggest buzzword in the Python world advertised as a silver bullet capable of solving all Python's shortcomings in the field of performance. However, it also brings a burden of being a completely new approach with a fresh implementation which is not often mentioned and taken into consideration. In some of my team's projects we've achieved a great success thanks to AsyncIO, but there's been a few where we decided to get rid of it and replace it with a more traditional fork-join architecture. I'd like to share my experience with AsyncIO, tell some War Stories and discuss which projects it suits perfectly and which ones should avoid it.","ASYNC / Concurreny,Debugging,Python 3,Use Case",AsyncIO in production - War Stories
Sven-Hendrik Haase,July 2019,There are many modern terminal tools with vastly improved user experiences as compared to their traditional alternatives. This talk aims to show off some of those modern terminal tools and compare them side by side with the traditional ones.,"Command-Line,Linux,System Administration,Tooling,Unix",Become a command line wizard
"Christian Heimes,Steve Dower",July 2019,"The Python Enhancement Proposal 551 describes the concept of security transparency for the CPython runtime environment. The PEP lists planned actions to detect anomalous or malicious use of Python and potentially prevent some abuse cases. The general idea is to make Python less useful for advanced persistent threats (APT). Python 3.8 will come with an implementation of PEP 578, auditing hooks and verified open call for reading code from files.","CPython,Security",Auditing hooks and security transparency for CPython
Jon Nordby,July 2019,"Sound is a rich source of information about the world around us.,Modern deep learning approaches can give human-like performance on a range of sound classifiction tasks.,This makes it possible to build systems that use sound to for example:,understand speech, to analyze music, to assist in medical diagnostics, detect quality problems in manufacturing, and to study the behavior of animals.","Data Science,Deep Learning,Machine-Learning",Audio Classification with Machine Learning
Danny Engelbarts,July 2019,The goal of this talk is to show the audience a different way of thinking about and developing regex statements. ,"Compiler and Interpreters,Mind Bending,Programming,Python Skills,Tooling",And now for something completely different.
Ben Nuttall,July 2019,A collaboration between the Raspberry Pi Foundation and the European Space Agency put two Raspberry Pi computers augmented with sensor boards and camera modules on the International Space Station in 2015. Every year we run a series of competitions for kids in schools around Europe to design science experiments using the available sensors.,"Data,Education,Linux,OpenCV,Raspberry PI",Astro Pi: Python on the International Space Station
Raphael Pierzina,July 2019,"There are many reasons why I think pytest is a fantastic test framework: assertion introspection, setup and teardown with fixtures, parametrized tests. But plugins are the real game changer!","Test Libraries (pytest/nose/...),Testing,python",Advanced pytest
Lynn Root,July 2019,"By building a simplified chaos monkey service, we will walk through how to create a good foundation for an asyncio-based service, including graceful shutdowns, proper exception handling, and testing asynchronous code. We’ll get into the hairier topics as well, covering topics like working with synchronous code, debugging and profiling, and working with threaded code. We’ll learn how to approach asynchronous and concurrent programming with Python’s asyncio library, take away some best practices, and learn what pitfalls to avoid.","ASYNC / Concurreny,Best Practice,Development",Advanced asyncio: Solving Real-world Production Problems
Victor Stinner,July 2019,"Python Performance: Past, Present and Future",python,"Python Performance: Past, Present and Future"
Miroslav Šedivý,July 2019,"On the last Sunday of October you may get “one more hour of sleep” but as well may spend much more time debugging code dealing with the time zones, daylight saving time shifts and datetime stuff in general.","Best Practice,Community,Python general,The Answer to Life the Universe and Everything Else,failures/mistakes",A Day Has Only 24±1 Hours
Yenny Cheung,July 2019,"Fear of public speaking is the most common of all phobias. Want to speak confidently in front of the crowd? This talk shares tips on how to overcome the fear, and ways to get started. You will be prepared to brace presenting from a team meeting to a conference.",Community,Why You Should Pursue Public Speaking and How to Get There
Shailen Sobhee,July 2019,"Learn about Intel® Deep Learning Boost, also known as Vector Neural Network Instructions (VNNI), a new set of AVX-512 instructions, that are designed to deliver significantly more efficient Deep Learning (Inference) acceleration. Through this technology, I will show you how you can perform low-precision (INT8) inference much faster on hardware that support the VNNI instruction set (for example, the 2nd generation Intel Xeon Scalable processors, codenamed, Cascade Lake). In the live Jupyter notebook session, you can will be able to see the benefits of this new hardware technology. ","Data Science,Deep Learning,Performance,python",Accelerate your Deep Learning Inferencing with the Intel® DL Boost technology
Lynn Cherny,July 2019,"Most of us work too much and play too little.  When was the last time you smiled at something you made?  Playing with fun datasets, especially big data sets, opens up weird new forms of technical recreation.  Why not train an amusing model in a browser tab while you're waiting for that day-job Spark query to finish?  I'll show you some data toys I've built using AI and interesting data sets: Most of them involve both backend data science and front-end visualization tricks.  They range from poetry-composition helpers to game log analysis to image deconstruction and reconstruction. All of them taught me something, often about myself and what I like artistically, and sometimes about what ""big data"" actually means.","Big Data,Deep Learning,Visualization",Getting Your Data Joie De Vivre Back!
Athina Frantzana,July 2019,"This study is the first attempt to understand the current gender demographics of the HPC community, and identify potential reasons and ways to tackle the gender imbalance. By listening to the people who constitute the community, the study offers a guideline on what the HPC community should focus on in order to become more attractive, accessible and useful to everyone.",Diversity,Are women underrepresented in the High Performance Computing (HPC) community?
